Property	Expected Type	Description	Type	Type URL	BSC Description	Marginality	Cardinality	Controlled Vocabulary	Example
additionalType	URL	An additional type for the item, typically used for adding more specific types from external vocabularies in microdata syntax. This is a relationship between something and a class that the thing is in. In RDFa syntax, it is better to use the native RDFa syntax - the 'typeof' attribute - for multiple types. Schema.org tools may have only weaker understanding of extra types, in particular those defined externally.	external	http://security.polito.it/ontology/	The additional type is defined at http://security.polito.it/ontology/	Optional	ONE	https://github.com/Vocamp/computationalEnvironmentODP/blob/master/data/ComputationalEnvironment.rdf	
alternateName	Text	An alias for the item.				Recommended	MANY		
description	Text	A description of the item.			A description of the virtualization technology	Minimum	ONE		
identifier	PropertyValue or  Text or  URL	The identifier property represents any kind of identifier for any kind of Thing, such as ISBNs, GTIN codes, UUIDs etc. Schema.org provides dedicated properties for representing many of these, either as textual strings or as URL (URI) links. See [background notes](http://schema.org/docs/datamodel.html#identifierBg) for more details.			An identifier for the virtualization technology.	Recommended	ONE		
name	Text	The name of the item.			The name of the virtualization technology	Minimum	ONE		
url	URL	URL of the item.			A url associated with the virtualization technology.	Minimum	ONE		